{"$schema":"https://json-schema.org/draft/2020-12/schema","$id":"https://catalog.local/schemas/v1/normalization-manifest.schema.json","title":"normalization-manifest","type":"object","additionalProperties":false,"required":["schema_version","rules_version","producer","plan_fingerprint","fingerprint","files","counts","fixture_only","structure_verified","offline","network_requests","api_calls","imported","published"],"properties":{"schema_version":{"const":"1.0.0"},"rules_version":{"const":"normalization-ep-v1"},"producer":{"const":"catalog-normalize"},"plan_fingerprint":{"type":"string"},"fingerprint":{"type":"string"},"files":{"type":"array"},"counts":{"type":"object"},"fixture_only":{"type":"boolean"},"structure_verified":{"type":"boolean"},"offline":{"const":true},"network_requests":{"const":0},"api_calls":{"const":0},"imported":{"const":false},"published":{"const":false}}}
