{"schema_version":"1.0.0","rules_version":"normalization-ep-v1","producer":"catalog-normalize","plan_fingerprint":"aaaaaaaaaaaaaaaaaaaaaaaaaaaaaaaaaaaaaaaaaaaaaaaaaaaaaaaaaaaaaaaa","fingerprint":"bbbbbbbbbbbbbbbbbbbbbbbbbbbbbbbbbbbbbbbbbbbbbbbbbbbbbbbbbbbbbbbb","files":[],"counts":{},"fixture_only":true,"structure_verified":false,"offline":true,"network_requests":0,"api_calls":0,"imported":false,"published":false}
